{
  "$schema": "https://tree-of-sophia.local/ToS/contracts/philosophy-source-planting.schema.json",
  "schema_version": "tos_philosophy_source_planting_v1",
  "planting_id": "tos.planting.a18.registry-pali-an6-8-sujato-english",
  "atlas_row_id": "A18",
  "dossier_id": "A18",
  "branch_path": "ToS/philosophy/eras/axial-age/regions/south-asia/traditions/shramana-early-buddhist-jain",
  "source_backlog_anchor": {
    "path": "ToS/philosophy/eras/axial-age/regions/south-asia/traditions/shramana-early-buddhist-jain/sources/source-anchor-backlog.jsonl",
    "line": 10,
    "source_table_index": 12,
    "source_row_index": 1,
    "source_label": "Nikāya / Āgama-параллели"
  },
  "source_witness": {
    "work_id": "tos.work.pali-canon.an6.8",
    "record_ref": "ToS/source-witnesses/works/pali-canon/an6-8/work.json",
    "relationship": "grounds_source_backlog_anchor"
  },
  "discovery_ref": "ToS/source-witnesses/discovery/runs/registry-pali-an6-8-sujato-english.2026-09-12.v1.json",
  "provenance_event_ref": "tos.event.discovery.registry-20260912.pali-an6-8-sujato-english",
  "research_ref": "ToS/source-witnesses/discovery/registry-seventeenth-planting-2026-09-12/translations/SOURCE_AND_RIGHTS_REVIEW.md",
  "fulfilled_source_needs": [
    "Exact an6.8 English reading version alongside the retained Pali witness within the early Buddhist Nikaya source need; no Agama parallel or entire recension admission.",
    "Exact prepared version is locally retained: 1 immutable files; Item manifest fixes SHA-256 and resource inventory records observed coverage."
  ],
  "remaining_controls": [
    "Grouped UID carriers in AN1–11 and SN36–56 are explicitly deferred; this batch preserves each original aggregate carrier and does not split it into individual Works.",
    "Exact supplied SuttaCentral UID identifies this separately retained discourse; a title match never merges different UIDs.",
    "Complete pinned JSON is supplied digital-file coverage, not complete ancient recitation, textual correctness, historical truth or canon admission.",
    "Pali edition lineage, modern segment IDs and English translation remain distinct. Shared keys do not establish accepted semantic alignment.",
    "SN UID, vagga heading and segment numbering are preserved as supplied digital coordinates; no equivalence to printed paragraph numbering or another recension is inferred.",
    "Nikaya corpus leads remain broader than this constituent discourse; Agama parallels and other recensions are not supplied by this intake.",
    "Bhikkhu Sujato is the modern English translator; reported 2016–2018 translation work and first publication 2018 do not date the ancient discourse.",
    "The pinned current publication metadata retains CC0 and separately requests no AI training, model/algorithm development or AI-derived technologies. Preserve that request; this intake assesses local preservation and reading, not AI derivative use or translation quality.",
    "Bounded English opening exposes supplied UID/title keys ['an6.8']; the opening is incomplete and does not establish alignment or translation quality.",
    "Bounded Pali opening exposes supplied UID/title keys ['an6.8']; the opening is incomplete and does not establish full-text custody or acceptance.",
    "Local file custody and branch route do not admit text, translation, semantics or canon."
  ],
  "research_order": [
    "official_and_classical_documentation",
    "established_top_scholarship",
    "fresh_current_relevance_check"
  ],
  "authority": {
    "source_status": "metadata_witness_planted",
    "review_status": "unreviewed",
    "source_text_admitted": false,
    "semantic_status": "not_started",
    "graph_status": "not_promoted",
    "canon_status": "not_canon",
    "human_task_created": false
  },
  "status": "source_witness_planted",
  "maker": {
    "maker_type": "model",
    "agent_ref": "model:codex",
    "human_review_performed": false
  },
  "created_at": "2026-09-12T18:26:58.414239+00:00",
  "record_version": 1
}
