{
  "$schema": "https://tree-of-sophia.local/ToS/contracts/philosophy-source-planting.schema.json",
  "schema_version": "tos_philosophy_source_planting_v1",
  "planting_id": "tos.planting.a18.registry-pali-sn1-70-root",
  "atlas_row_id": "A18",
  "dossier_id": "A18",
  "branch_path": "ToS/philosophy/eras/axial-age/regions/south-asia/traditions/shramana-early-buddhist-jain",
  "source_backlog_anchor": {
    "path": "ToS/philosophy/eras/axial-age/regions/south-asia/traditions/shramana-early-buddhist-jain/sources/source-anchor-backlog.jsonl",
    "line": 10,
    "source_table_index": 12,
    "source_row_index": 1,
    "source_label": "Nikāya / Āgama-параллели"
  },
  "source_witness": {
    "work_id": "tos.work.pali-canon.sn1.70",
    "record_ref": "ToS/source-witnesses/works/pali-canon/sn1-70/work.json",
    "relationship": "grounds_source_backlog_anchor"
  },
  "discovery_ref": "ToS/source-witnesses/discovery/runs/registry-pali-sn1-70-root.2026-09-09.v1.json",
  "provenance_event_ref": "tos.event.discovery.registry-20260909.pali-sn1-70-root",
  "research_ref": "ToS/source-witnesses/discovery/registry-fourteenth-planting-2026-09-09/SOURCE_AND_RIGHTS_REVIEW.md",
  "fulfilled_source_needs": [
    "Exact sn1.70 Pali discourse witness within the early Buddhist Nikaya source need; no Agama parallel or entire recension admission.",
    "Exact prepared version is locally retained: 1 immutable files; Item manifest fixes SHA-256 and resource inventory records observed coverage."
  ],
  "remaining_controls": [
    "Exact supplied SuttaCentral UID identifies this separately retained discourse; a title match never merges different UIDs.",
    "Complete pinned JSON is supplied digital-file coverage, not complete ancient recitation, textual correctness, historical truth or canon admission.",
    "Pali edition lineage, modern segment IDs and English translation remain distinct. Shared keys do not establish accepted semantic alignment.",
    "SN UID, vagga heading and segment numbering are preserved as supplied digital coordinates; no equivalence to printed paragraph numbering or another recension is inferred.",
    "Nikaya corpus leads remain broader than this constituent discourse; Agama parallels and other recensions are not supplied by this intake.",
    "Local file custody and branch route do not admit text, translation, semantics or canon."
  ],
  "research_order": [
    "official_and_classical_documentation",
    "established_top_scholarship",
    "fresh_current_relevance_check"
  ],
  "authority": {
    "source_status": "metadata_witness_planted",
    "review_status": "unreviewed",
    "source_text_admitted": false,
    "semantic_status": "not_started",
    "graph_status": "not_promoted",
    "canon_status": "not_canon",
    "human_task_created": false
  },
  "status": "source_witness_planted",
  "maker": {
    "maker_type": "model",
    "agent_ref": "model:codex",
    "human_review_performed": false
  },
  "created_at": "2026-09-09T23:21:15.198469+00:00",
  "record_version": 1
}
